{
  "schema_version": "1.0",
  "run_id": "d0c0e440c467f446",
  "cwe_id": "CWE-476",
  "spec_id": "cwe476_plan_006",
  "seed": 1,
  "mutations": [
    {
      "file": "counter.c",
      "line": 41,
      "mutation_type": "remove_null_guard",
      "original_fragment": "    if (!c) return;",
      "mutated_fragment": "/* CWE-476: null guard removed */",
      "extra": {
        "guard_line": 41,
        "deref_line": -1,
        "guarded_pointer": "c",
        "multiline": false,
        "body_lines": []
      }
    }
  ],
  "validation_passed": true
}
