{
  "schema_version": "1.0",
  "run_id": "c2fd14595431c2ae",
  "cwe_id": "CWE-476",
  "spec_id": "cwe476_plan_010",
  "seed": 2,
  "mutations": [
    {
      "file": "ringbuf.c",
      "line": 69,
      "mutation_type": "remove_null_guard",
      "original_fragment": "    if (!rb) return;",
      "mutated_fragment": "/* CWE-476: null guard removed */",
      "extra": {
        "guard_line": 69,
        "deref_line": -1,
        "guarded_pointer": "rb",
        "multiline": false,
        "body_lines": []
      }
    }
  ],
  "validation_passed": true
}
