{
  "schema_version": "1.0",
  "run_id": "04d331b46445d060",
  "cwe_id": "CWE-476",
  "spec_id": "cwe476-sandbox-queue-node-004",
  "seed": 4,
  "mutations": [
    {
      "file": "graph.c",
      "line": 264,
      "mutation_type": "remove_null_guard",
      "original_fragment": "    if (!g) return;",
      "mutated_fragment": "/* CWE-476: null guard removed */",
      "extra": {
        "guard_line": 264,
        "deref_line": -1,
        "guarded_pointer": "g",
        "multiline": false,
        "body_lines": []
      }
    }
  ],
  "validation_passed": true
}
